source,package_path,asset_type,decision,reason
/Users/dlev2617/Documents/Papers/~05-Published/TEMA/TeMA-MarkovLU/2985-15923-1-PB.pdf,paper/A-Markov-Chain-Model-of-Land-Use-Change.pdf,paper,included,Final published TeMA PDF used for audit validation.
"/Users/dlev2617/Documents/Papers/~05-Published/TEMA/TeMA-MarkovLU/[TeMA] A Markov Chain Model of Land Use Change in the Twin Cities, 1958-2005.doc",,manuscript,excluded_replaced_by_final_pdf,Local DOC manuscript was replaced by final published PDF in package.
/Users/dlev2617/Documents/Data/~Nexus_Data/NSF Career Network Growth/Network Growth CDs/Network Growth CDs/Landuse_GIS,,historical_landuse_gis,not_copied_shared_context,Readable 1958/1968/1978/1990/2000 source context; represented by shared package/documentation and should not be duplicated in per-paper folder.
/Users/dlev2617/Documents/Code/Agents/github-packages/_shared_sources/twin-cities-historical-landuse-markov/data/markov_gis_public_source_subset/Landuse_GIS,README.md,shared_packaged_data_subset,reference_only,Existing staged subset covers related Markov land-use data for both papers; 2015-07 should point to shared data rather than duplicate.
/Users/dlev2617/Documents/Code/Agents/github-packages/_shared_sources/twin-cities-historical-landuse-markov/data/markov_gis_public_source_subset,documentation/SHARED_DATA_DEPENDENCY.md,canonical_shared_data_package,shared_dependency,"Wei Chen / Paving New Ground package is the canonical staged Markov land-use package; this paper should reference/share it instead of copying another 1.1 GB data tree."
/Users/dlev2617/Documents/Data/~Nexus_Data/Access to Destinations Project/Rania-Iacono Land Use Data,data/rania_iacono_grid_land_use_1960_2000,historical_landuse_grid_table,included,"User-identified Rania-Iacono source copied into package. Includes All_in1.xlsx with GRIDID and TYPE1/2/3 fields for 60/70/80/90/00, plus GRIDsmall shapefile geometry."
1984/1997/2005 source GIS layers or model-ready tables,,unpackaged_analysis_context,documented_caveat,Paper states these years are used; visible package evidence does not expose standalone folders for those years. Treat as a provenance/reproducibility caveat rather than a reason to keep the package in SEARCH.
TeMA-MarkovLU working folders,,drafts_and_submission_material,excluded_nonarchival,"Contains drafts, decision letters, images, LaTeX build products, and manuscript versions; not copied."
